{
  "schema_version": "1.0",
  "video": "synthetic_shots.mp4",
  "player_id": "p1",
  "reps": [
    {
      "rep_id": "r001",
      "move": "shot_instep",
      "foot": "right",
      "frames": {
        "start": 0,
        "plant": 96,
        "contact": 103,
        "end": 143
      },
      "confidence": 1.0
    },
    {
      "rep_id": "r002",
      "move": "shot_instep",
      "foot": "left",
      "frames": {
        "start": 228,
        "plant": 324,
        "contact": 331,
        "end": 371
      },
      "confidence": 1.0
    }
  ]
}